{
  "schema": "subactor.development-evidence/v1",
  "source": "fixture",
  "graphFingerprint": "aa344be4e9f724b377ca1bbf11d31d9900a27b4bcdc559c68f994338e62dd004",
  "recordCount": 2,
  "relationCount": 0,
  "diagnosticCount": 0,
  "blockingDiagnosticCount": 0,
  "acceptance": "review_required",
  "manifestStatus": null,
  "evidenceUris": [
    "urn:subactor:intent:sha256:aa344be4e9f724b377ca1bbf11d31d9900a27b4bcdc559c68f994338e62dd004"
  ]
}
